{
  "configVersion": 1,
  "application": {
    "name": "cadence",
    "environment": "beta",
    "publicUrl": "https://cadence-ci.example.invalid",
    "apiBaseUrl": "",
    "requestBodyLimitBytes": 1048576
  },
  "runtime": { "provider": "cloudflare" },
  "cloudflare": {
    "accountId": "account-ci",
    "workerName": "worker-ci"
  },
  "supabase": {
    "url": "https://abc123.supabase.co",
    "projectRef": "abc123",
    "publishableKey": "sb_publishable_ci",
    "secretKeySecretRef": "SUPABASE_SECRET_KEY"
  },
  "pilot": {
    "projectId": "11111111-1111-4111-8111-111111111111",
    "safeTargetMarker": "cadence-ci"
  },
  "worker": {
    "schedule": "* * * * *",
    "maxRounds": 10,
    "maxDeliveryAttempts": 20,
    "maxMembershipExpiryAttempts": 20,
    "softDeadlineSeconds": 20
  },
  "retry": { "delaysSeconds": [60, 300, 900, 3600] }
}
